{
  "identity_matches": [],
  "topics": [],
  "stated_views": [],
  "rejected_count": 0,
  "item_result": {
    "item": null,
    "item_key": "",
    "item_label": "",
    "status": "skipped",
    "headline": "Empty slot.",
    "source_ids": []
  },
  "report": {
    "title": "Empty slot",
    "summary": "",
    "severity": "info",
    "sections": [],
    "sources": [],
    "unknowns": [],
    "meta": {
      "skill": "person-public-profile",
      "skill_version": "1.0.0",
      "generated_at": "2026-10-12T09:00:00Z"
    }
  }
}